{
  "$schema": "https://json-schema.org/draft/2020-12/schema",
  "$id": "https://example.invalid/osu-ai-mapping-ir/0.1.0/schema.json",
  "title": "osu! AI Mapping IR v0.1",
  "description": "Semantic-first intermediate representation for AI-assisted osu! beatmap planning and rendering.",
  "type": "object",
  "required": ["schema", "version", "document_id", "map", "ruleset", "difficulty_profile", "music_timeline", "mapping_plan", "constraints", "provenance", "evaluation"],
  "properties": {
    "schema": {"const": "osu-ai-mapping-ir"},
    "version": {"const": "0.1.0"},
    "document_id": {"type": "string", "minLength": 1},
    "map": {"$ref": "#/$defs/mapInfo"},
    "ruleset": {"$ref": "#/$defs/ruleset"},
    "difficulty_profile": {"$ref": "#/$defs/difficultyProfile"},
    "music_timeline": {"$ref": "#/$defs/musicTimeline"},
    "mapping_plan": {"$ref": "#/$defs/mappingPlan"},
    "concrete_objects": {
      "type": "array",
      "items": {"$ref": "#/$defs/concreteObject"}
    },
    "constraints": {"$ref": "#/$defs/constraints"},
    "style": {"anyOf": [{"$ref": "#/$defs/styleProfile"}, {"type": "null"}]},
    "provenance": {"$ref": "#/$defs/provenance"},
    "evaluation": {"$ref": "#/$defs/evaluation"}
  },
  "$defs": {
    "id": {"type": "string", "minLength": 1},
    "timeMs": {"type": "integer", "minimum": 0},
    "score01": {"type": "number", "minimum": 0, "maximum": 1},
    "mapInfo": {
      "type": "object",
      "required": ["audio_hash"],
      "properties": {
        "audio_hash": {"type": "string", "minLength": 1},
        "beatmap_id": {"type": ["integer", "null"]},
        "difficulty_id": {"type": ["integer", "null"]},
        "title": {"type": ["string", "null"]},
        "artist": {"type": ["string", "null"]},
        "creator": {"type": ["string", "null"]}
      },
      "additionalProperties": false
    },
    "ruleset": {
      "type": "object",
      "required": ["ruleset", "variant"],
      "properties": {
        "ruleset": {"enum": ["osu", "taiko", "catch", "mania"]},
        "variant": {
          "type": "object",
          "properties": {
            "keys": {"type": ["integer", "null"], "minimum": 1, "maximum": 18},
            "circle_size": {"type": ["number", "null"], "minimum": 0, "maximum": 11}
          },
          "additionalProperties": true
        }
      },
      "additionalProperties": false
    },
    "difficultyProfile": {
      "type": "object",
      "required": ["target_star_rating", "dimensions", "preferences"],
      "properties": {
        "target_star_rating": {"type": ["number", "null"], "minimum": 0},
        "tolerance": {"type": "number", "minimum": 0},
        "dimensions": {
          "type": "object",
          "required": ["density", "rhythm_complexity", "reading", "stamina", "technicality", "movement", "ln_complexity"],
          "properties": {
            "density": {"$ref": "#/$defs/score01"},
            "rhythm_complexity": {"$ref": "#/$defs/score01"},
            "reading": {"$ref": "#/$defs/score01"},
            "stamina": {"$ref": "#/$defs/score01"},
            "technicality": {"$ref": "#/$defs/score01"},
            "movement": {"$ref": "#/$defs/score01"},
            "ln_complexity": {"$ref": "#/$defs/score01"}
          },
          "additionalProperties": false
        },
        "preferences": {
          "type": "object",
          "properties": {
            "allow_extreme_patterns": {"type": "boolean"},
            "prefer_readability": {"type": "boolean"},
            "prefer_music_sync": {"type": "boolean"},
            "prefer_pattern_variety": {"type": "boolean"}
          },
          "additionalProperties": true
        }
      },
      "additionalProperties": false
    },
    "musicTimeline": {
      "type": "object",
      "required": ["duration_ms", "tempo", "sections", "phrases", "events"],
      "properties": {
        "duration_ms": {"$ref": "#/$defs/timeMs"},
        "tempo": {"$ref": "#/$defs/tempo"},
        "sections": {"type": "array", "items": {"$ref": "#/$defs/section"}},
        "phrases": {"type": "array", "items": {"$ref": "#/$defs/phrase"}},
        "events": {"type": "array", "items": {"$ref": "#/$defs/musicEvent"}}
      },
      "additionalProperties": false
    },
    "tempo": {
      "type": "object",
      "required": ["base_bpm", "changes"],
      "properties": {
        "base_bpm": {"type": "number", "exclusiveMinimum": 0},
        "changes": {
          "type": "array",
          "items": {
            "type": "object",
            "required": ["time_ms", "bpm"],
            "properties": {
              "time_ms": {"$ref": "#/$defs/timeMs"},
              "bpm": {"type": "number", "exclusiveMinimum": 0}
            },
            "additionalProperties": false
          }
        }
      },
      "additionalProperties": false
    },
    "section": {
      "type": "object",
      "required": ["id", "start_time", "end_time", "type", "energy", "confidence"],
      "properties": {
        "id": {"$ref": "#/$defs/id"},
        "start_time": {"$ref": "#/$defs/timeMs"},
        "end_time": {"$ref": "#/$defs/timeMs"},
        "type": {"enum": ["intro", "verse", "pre_chorus", "chorus", "drop", "bridge", "break", "outro", "instrumental", "transition", "unknown"]},
        "energy": {"$ref": "#/$defs/score01"},
        "confidence": {"$ref": "#/$defs/score01"},
        "labels": {"type": "array", "items": {"type": "string"}}
      },
      "additionalProperties": false
    },
    "phrase": {
      "type": "object",
      "required": ["id", "section_id", "start_time", "end_time", "type", "musical_role"],
      "properties": {
        "id": {"$ref": "#/$defs/id"},
        "section_id": {"$ref": "#/$defs/id"},
        "start_time": {"$ref": "#/$defs/timeMs"},
        "end_time": {"$ref": "#/$defs/timeMs"},
        "type": {"enum": ["vocal_phrase", "instrumental_phrase", "rhythm_phrase", "melodic_phrase", "call_response", "motif", "fill", "unknown"]},
        "musical_role": {"enum": ["lead", "support", "rhythm", "bass", "transition", "accent", "background", "unknown"]}
      },
      "additionalProperties": false
    },
    "musicEvent": {
      "type": "object",
      "required": ["id", "time", "duration", "type", "strength", "confidence", "source"],
      "properties": {
        "id": {"$ref": "#/$defs/id"},
        "time": {"$ref": "#/$defs/timeMs"},
        "duration": {"type": "integer", "minimum": 0},
        "type": {"enum": ["beat", "onset", "kick", "snare", "hihat", "percussion", "bass", "chord", "vocal", "vocal_phrase", "melody", "accent", "silence", "transition"]},
        "phrase_id": {"type": ["string", "null"]},
        "strength": {"$ref": "#/$defs/score01"},
        "features": {"type": "object", "additionalProperties": {"type": ["number", "string", "boolean", "null"]}},
        "confidence": {"$ref": "#/$defs/score01"},
        "source": {"type": "string"}
      },
      "additionalProperties": false
    },
    "mappingPlan": {
      "type": "object",
      "required": ["intents", "patterns", "transitions"],
      "properties": {
        "intents": {"type": "array", "items": {"$ref": "#/$defs/mappingIntent"}},
        "patterns": {"type": "array", "items": {"$ref": "#/$defs/patternIntent"}},
        "transitions": {"type": "array", "items": {"$ref": "#/$defs/transition"}}
      },
      "additionalProperties": false
    },
    "mappingIntent": {
      "type": "object",
      "required": ["id", "start_time", "end_time", "primary", "secondary", "musical_targets", "emphasis", "complexity", "confidence"],
      "properties": {
        "id": {"$ref": "#/$defs/id"},
        "start_time": {"$ref": "#/$defs/timeMs"},
        "end_time": {"$ref": "#/$defs/timeMs"},
        "primary": {"enum": ["establish", "repeat", "variation", "escalation", "release", "climax", "de_escalation", "contrast", "transition", "accent", "silence", "anticipation", "resolution"]},
        "secondary": {"type": "array", "items": {"type": "string"}},
        "musical_targets": {"type": "array", "items": {"type": "string"}},
        "continuity": {
          "type": "object",
          "properties": {
            "relation": {"enum": ["start_new", "continue", "repeat", "vary", "contrast", "release", "reset"]},
            "reference": {"type": ["string", "null"]}
          },
          "additionalProperties": false
        },
        "emphasis": {
          "type": "object",
          "required": ["rhythm", "density", "movement", "pattern_complexity", "accent", "contrast"],
          "properties": {
            "rhythm": {"$ref": "#/$defs/score01"},
            "density": {"$ref": "#/$defs/score01"},
            "movement": {"$ref": "#/$defs/score01"},
            "pattern_complexity": {"$ref": "#/$defs/score01"},
            "accent": {"$ref": "#/$defs/score01"},
            "contrast": {"$ref": "#/$defs/score01"}
          },
          "additionalProperties": false
        },
        "complexity": {"$ref": "#/$defs/score01"},
        "confidence": {"$ref": "#/$defs/score01"},
        "rationale": {"type": "string"}
      },
      "additionalProperties": false
    },
    "patternIntent": {
      "type": "object",
      "required": ["id", "ruleset", "family", "start_time", "end_time", "parameters", "constraints", "confidence"],
      "properties": {
        "id": {"$ref": "#/$defs/id"},
        "ruleset": {"enum": ["osu", "taiko", "catch", "mania"]},
        "family": {"type": "string", "minLength": 1},
        "start_time": {"$ref": "#/$defs/timeMs"},
        "end_time": {"$ref": "#/$defs/timeMs"},
        "parameters": {"type": "object", "additionalProperties": true},
        "constraints": {"type": "object", "additionalProperties": true},
        "transition_in": {"type": ["string", "null"]},
        "transition_out": {"type": ["string", "null"]},
        "confidence": {"$ref": "#/$defs/score01"},
        "rationale": {"type": "string"}
      },
      "additionalProperties": false
    },
    "transition": {
      "type": "object",
      "required": ["id", "from_pattern", "to_pattern", "transition_type", "constraints"],
      "properties": {
        "id": {"$ref": "#/$defs/id"},
        "from_pattern": {"$ref": "#/$defs/id"},
        "to_pattern": {"$ref": "#/$defs/id"},
        "transition_type": {"type": "string"},
        "overlap": {
          "type": ["object", "null"],
          "properties": {
            "start": {"$ref": "#/$defs/timeMs"},
            "end": {"$ref": "#/$defs/timeMs"}
          },
          "required": ["start", "end"],
          "additionalProperties": false
        },
        "constraints": {"type": "object", "additionalProperties": true}
      },
      "additionalProperties": false
    },
    "concreteObject": {
      "type": "object",
      "required": ["id", "type", "time"],
      "properties": {
        "id": {"$ref": "#/$defs/id"},
        "type": {"type": "string"},
        "time": {"$ref": "#/$defs/timeMs"},
        "end_time": {"type": ["integer", "null"], "minimum": 0},
        "column": {"type": ["integer", "null"], "minimum": 0},
        "position": {
          "type": ["object", "null"],
          "properties": {
            "x": {"type": "number"},
            "y": {"type": "number"}
          },
          "required": ["x", "y"],
          "additionalProperties": false
        },
        "source_pattern_id": {"type": ["string", "null"]}
      },
      "additionalProperties": false
    },
    "constraints": {
      "type": "object",
      "properties": {
        "timing": {
          "type": "object",
          "properties": {
            "snap": {"enum": ["beat_grid", "free", "hybrid"]},
            "allowed_subdivisions": {"type": "array", "items": {"type": "string"}}
          },
          "additionalProperties": false
        },
        "playability": {"type": "object", "additionalProperties": true},
        "music_alignment": {"type": "object", "additionalProperties": true}
      },
      "additionalProperties": false
    },
    "styleProfile": {
      "type": "object",
      "required": ["id", "parameters"],
      "properties": {
        "id": {"type": "string"},
        "parameters": {"type": "object", "additionalProperties": {"type": ["number", "string", "boolean"]}}
      },
      "additionalProperties": false
    },
    "provenance": {
      "type": "object",
      "required": ["origin"],
      "properties": {
        "origin": {"enum": ["human", "rule_based", "ai_generated", "hybrid", "imported"]},
        "agent": {
          "type": ["object", "null"],
          "properties": {
            "name": {"type": "string"},
            "version": {"type": "string"}
          },
          "additionalProperties": false
        },
        "model": {
          "type": ["object", "null"],
          "properties": {
            "provider": {"type": "string"},
            "name": {"type": "string"},
            "version": {"type": "string"}
          },
          "additionalProperties": false
        },
        "generated_at": {"type": ["string", "null"], "format": "date-time"},
        "human_edits": {"type": "array", "items": {"$ref": "#/$defs/humanEdit"}}
      },
      "additionalProperties": false
    },
    "humanEdit": {
      "type": "object",
      "required": ["type", "time_range"],
      "properties": {
        "type": {"enum": ["add", "delete", "move", "replace_pattern", "change_rhythm", "change_ln", "other"]},
        "time_range": {
          "type": "array",
          "prefixItems": [{"$ref": "#/$defs/timeMs"}, {"$ref": "#/$defs/timeMs"}],
          "minItems": 2,
          "maxItems": 2
        },
        "from": {"type": ["string", "null"]},
        "to": {"type": ["string", "null"]}
      },
      "additionalProperties": false
    },
    "evaluation": {
      "type": "object",
      "properties": {
        "valid": {"type": ["boolean", "null"]},
        "difficulty": {"type": "object", "additionalProperties": true},
        "music_alignment_score": {"type": ["number", "null"], "minimum": 0, "maximum": 1},
        "transition_score": {"type": ["number", "null"], "minimum": 0, "maximum": 1},
        "human_acceptance": {"type": ["number", "null"], "minimum": 0, "maximum": 1},
        "issues": {"type": "array", "items": {"type": "object", "additionalProperties": true}}
      },
      "additionalProperties": false
    }
  }
}
